id,name,email,bio,skills
1,John Doe,johndoe@example.com,"John is a passionate junior developer with a strong background in front-end technologies. He recently completed a web development bootcamp, where he built multiple responsive websites using React, CSS, and HTML. John is eager to apply his skills in a real-world setting and grow as a developer. He is highly detail-oriented and a fast learner.","React, CSS, HTML, Git"
2,Sarah Lee,sarahlee@example.com,"Sarah is a self-taught developer who has been building personal projects for the past year. Her portfolio includes a fully responsive personal blog and a task manager app, both built using React and Next.js. She enjoys the challenge of problem-solving and is constantly expanding her skill set through online courses. Sarah thrives in collaborative environments and is excited to contribute to team projects.","React, Next.js, JavaScript, CSS, HTML"
3,Michael Young,michaelyoung@example.com,"Michael recently graduated from a coding bootcamp and is skilled in web development, particularly in React-based applications. During his bootcamp, he worked on a capstone project where he developed a social media dashboard using React, JavaScript, and Git for version control. Michael is passionate about technology and is looking for an opportunity to apply his skills in a dynamic team environment.","React, JavaScript, CSS, Git"
4,Linda Smith,lindasmith@example.com,"Linda is an experienced full-stack developer with a focus on front-end technologies. She has over three years of experience working with React and Next.js. Recently, she has been exploring AI integrations, using the Vercel AI SDK and CrewAI to enhance user experiences in web applications. Linda excels at creating seamless, user-friendly interfaces and optimizing performance.","React, Next.js, JavaScript, Vercel AI SDK, CrewAI, REST APIs"
5,Tom Brown,tombrown@example.com,"Tom is a mid-level developer with hands-on experience working on commercial projects using React and Next.js. He has built several customer-facing websites and eCommerce platforms, focusing on performance optimization and SEO. He is proficient in REST APIs and enjoys building scalable web solutions that improve user engagement.","React, Next.js, CSS, HTML, Git, REST APIs"
6,Kate Adams,kateadams@example.com,"Kate is an AI enthusiast with a solid background in front-end development and experience using the Vercel AI SDK and CrewAI. She has contributed to projects that leverage AI to improve user interaction and personalization. Kate is passionate about staying at the cutting edge of technology and is excited to work on projects that push the boundaries of what's possible.","React, Next.js, Vercel AI SDK, CrewAI, JavaScript, Git"
